headline,url,category
‘It’s the misogyny slop ecosystem!’ How Candace Owens and the American right declared war on Blake Lively,https://www.theguardian.com/film/2025/may/06/misogyny-slop-it-ends-with-us-america-rightwing-blake-lively-justin-baldoni,culture
"Drug runs for the Stones, a love triangle with Joni Mitchell: has Chris O’Dell had the music industry’s wildest career?",https://www.theguardian.com/music/2025/may/06/chris-odell-drug-runs-the-stones-love-triangle-joni-mitchell-george-harrison-,culture
google's privacy policy,https://policies.google.com/privacy,culture
google's terms of service,https://policies.google.com/terms,culture
Front row? Dublin orders tourists to leave statue’s cleavage alone,https://www.theguardian.com/politics/2025/may/06/breast-not-to-touch-dublin-orders-tourists-to-leave-molly-malone-alone,culture
"Denmark’s museum objects at risk from ‘extreme’ new mould, say conservators",https://www.theguardian.com/politics/2025/may/06/denmarks-museum-objects-at-risk-from-extreme-new-mould-say-conservators,culture
Man arrested after crashing car into front gate of Jennifer Aniston’s home,https://www.theguardian.com/film/2025/may/06/jennifer-aniston-home-car-crash,culture
Smokey Robinson accused of sexual assault by four women in $50m lawsuit,https://www.theguardian.com/us-news/2025/may/06/smokey-robinson-accused-sexual-assault,culture
‘I don’t have the power’: JK Rowling won’t sack Paapa Essiedu from Harry Potter TV show over trans rights views,https://www.theguardian.com/tv-and-radio/2025/may/06/i-dont-have-the-power-jk-rowling-wont-sack-paapa-essiedu-from-harry-potter-tv-show-over-trans-rights,culture
Jamie Cullum to compose music for RSC’s The Constant Wife starring Rose Leslie,https://www.theguardian.com/stage/2025/may/06/jamie-cullum-to-compose-music-for-rscs-the-constant-wife-starring-rose-leslie,culture
Jonny Greenwood and Israeli musician Dudu Tassa condemn ‘silencing’ after UK concerts pulled,https://www.theguardian.com/music/2025/may/06/jonny-greenwood-and-israeli-musician-dudu-tassa-condemn-silencing-after-uk-concerts-pulled,culture
Rihanna and A$AP Rocky reveal they are expecting third child at Met Gala,https://www.theguardian.com/music/2025/may/06/rihanna-asap-rocky-pregnant-third-child,culture
Sean ‘Diddy’ Combs’s sex-trafficking trial begins with jury selection in New York,https://www.theguardian.com/music/2025/may/05/sean-diddy-combs-sex-trafficking-trial-jury-selection,culture
The Illegals by Shaun Walker – gripping true stories of spies who lived deep undercover,https://www.theguardian.com/books/2025/may/07/the-illegals-by-shaun-walker-review-gripping-true-stories-of-spies-who-lived-deep-undercover,culture
The Names by Florence Knapp – the verdict on spring’s hottest debut,https://www.theguardian.com/books/2025/may/07/the-names-by-florence-knapp-the-verdict-on-springs-hottest-debut,culture
Desire: The Carl Craig Story – serious notes on a techno legend,https://www.theguardian.com/film/2025/may/07/desire-the-carl-craig-story-review-serious-notes-on-a-techno-legend,culture
"Sharp Corner – Ben Foster unravels in smart, darkly compelling thriller",https://www.theguardian.com/film/2025/may/06/sharp-corner-movie-review,culture
Drop Duchy – a sprawling challenge disguised as a block-dropping puzzler,https://www.theguardian.com/games/2025/may/06/drop-duchy-review,culture
The Uninvited – Walton Goggins and Pedro Pascal shine in tasty satire,https://www.theguardian.com/film/2025/may/06/the-uninvited-review-walton-goggins-pedro-pascal-nadia-conners,culture
Silence is Golden – Katherine Ryan would definitely kill your dog for cash,https://www.theguardian.com/tv-and-radio/2025/may/05/silence-is-golden-review-katherine-ryan-would-definitely-kill-your-dog-for-cash,culture
"Kula Shaker on making Govinda: ‘Crowds would sing the lyrics as, “Go cash your giro giro”’",https://www.theguardian.com/culture/2025/may/05/kula-shaker-govinda-sanskrit-radio,culture
‘I was the only person who didn’t know the words to Coldplay’: Anoushka Shankar’s honest playlist,https://www.theguardian.com/music/2025/may/04/anoushka-shankar-honest-playlist-norah-jones-ravi-massive-attack,culture
"‘Do something with your actions. Don’t just write a cheque’: Bonnie Raitt on activism, making men cry and 38 years of sobriety",https://www.theguardian.com/music/2025/may/01/bonnie-raitt-activism-making-men-cry-38-years-of-sobriety,culture
Rock’n’roles: Dwayne Johnson films – ranked!,https://www.theguardian.com/film/2025/may/01/dwayne-the-rock-johnson-films-ranked,culture
Mark Knopfler on Dire Straits’ Money for Nothing: ‘I wrote it in the window display of a New York appliance store’,https://www.theguardian.com/culture/2025/apr/28/mark-knopfler-dire-straits-money-for-nothing,culture
"Girl, so inspiring! Lorde’s 20 best songs – ranked",https://www.theguardian.com/music/2025/apr/24/girl-so-inspiring-lordes-20-best-songs-ranked,culture
"‘I hum the Chariots of Fire theme all day, every day’: Nigel Havers on beach-running, playing Michael Caine’s son and hating his name",https://www.theguardian.com/film/2025/apr/24/i-hum-the-chariots-of-fire-theme-all-day-every-day-nigel-havers-on-beach-running-playing-michael-caines-son-and-hating-his-name,culture
TV tonight: why did Germanwings flight 9525 crash?,https://www.theguardian.com/tv-and-radio/2025/may/07/tv-tonight-germanwings-flight-9525-crash-race-across-the-politics,culture
The Assessment to The Dark Knight: the seven best films to watch on TV this week,https://www.theguardian.com/tv-and-radio/2025/may/02/the-assessment-to-the-dark-knight-the-seven-best-films-to-watch-on-tv-this-week,culture
Octopus to Long Way Home: the seven best shows to stream this week,https://www.theguardian.com/tv-and-radio/2025/may/02/octopus-to-long-way-home-the-seven-best-shows-to-stream-this-week,culture
Heading to the top: stunning images by students,https://www.theguardian.com/artanddesign/gallery/2025/may/07/heading-to-the-top-stunning-images-by-students-in-pictures,culture
Under a cloud: the city smothered in smog,https://www.theguardian.com/artanddesign/gallery/2025/may/06/under-a-cloud-the-city-smothered-in-smog-in-pictures,culture
"Cliff-divers, floating drinkers and billion-dollar flies: everyday moments on Earth",https://www.theguardian.com/artanddesign/gallery/2025/may/01/lensculture-cliff-divers-floating-drinkers-billion-dollar-fly-farm-in-pictures,culture
Sing for your snapper: a life-affirming view of New York,https://www.theguardian.com/artanddesign/gallery/2025/apr/30/sing-for-your-snapper-a-life-affirming-view-of-new-york-in-pictures-arlene-gottfried,culture
‘A form of meditation’: a photographic haiku to Japan,https://www.theguardian.com/artanddesign/gallery/2025/apr/29/a-form-of-meditation-a-photographic-haiku-to-japan-in-pictures,culture
Shot from the hip! A street level view of 1970s New York,https://www.theguardian.com/artanddesign/gallery/2025/apr/24/shot-from-the-hip-a-street-level-view-of-1970s-new-york-in-pictures,culture
‘Filling in these gaps’: Paul McCartney’s recently rediscovered photographs,https://www.theguardian.com/music/2025/apr/23/paul-mccartney-photographs-los-angeles,culture
"Keith Haring, Kanagawa and Georgia O’Keeffe: highlights from NYC’s Photography Show – in pictures",https://www.theguardian.com/us-news/gallery/2025/apr/23/aipad-the-photography-show-in-pictures,culture
"‘Monks, politicians, drag queens – all life is here’: a trip to Japan’s Kyotographie festival",https://www.theguardian.com/artanddesign/2025/apr/23/a-trip-to-japan-kyotographie-festival-humanity-kyoto,culture
‘Tranquillising good taste’: can the National Gallery’s airy new entrance exorcise its demons?,https://www.theguardian.com/artanddesign/2025/may/06/national-gallery-sainsbury-wing,culture
‘I’m burping? At least I didn’t fart!’ Ten things I’ve learned about ageing rockers,https://www.theguardian.com/music/2025/may/05/brian-may-nearly-choked-on-his-goats-cheese-my-adventures-with-the-cosmic-dads-of-rocknroll,culture
"Happy birthday, David Attenborough! 99 ways he has inspired us, by Barack Obama, Billie Eilish, Morgan Freeman – and many more",https://www.theguardian.com/tv-and-radio/2025/may/03/david-attenborough-birthday-99-by-barack-obama-billie-eilish-morgan-freeman,culture
A child on thin ice: EA Hanks on life with her abusive mother – and politics-famous father,https://www.theguardian.com/lifeandstyle/2025/may/05/a-child-on-thin-ice-ea-hanks-on-life-with-her-abusive-mother-and-politics-famous-father,culture
‘Music is never fixed in me’ … cellist Sheku Kanneh-Mason on surviving a ‘volcano of racism’,https://www.theguardian.com/music/2025/may/02/music-is-never-fixed-in-me-cellist-sheku-kanneh-mason-on-surviving-a-volcano-of-racism,culture
Holy Krapp! Gary Oldman and Stephen Rea unspool Beckett’s masterpiece about memory,https://www.theguardian.com/stage/2025/may/02/holy-krapp-gary-oldman-and-stephen-rea-unspool-becketts-masterpiece-about-memory,culture
